{
  "schemaVersion": 2,
  "workspaceId": "ws-default",
  "checkedAt": "2026-04-02T12:48:17Z",
  "overall": "degraded",
  "checks": {
    "workspace": {
      "status": "pass",
      "message": "OK"
    },
    "controllerRelease": {
      "status": "pass",
      "message": "Tag: source-change",
      "detail": "Age: 0h"
    },
    "agentRelease": {
      "status": "pass",
      "message": "Tag: source-change",
      "detail": "Age: 68h"
    },
    "stuckRuns": {
      "status": "pass",
      "message": "None"
    },
    "locks": {
      "status": "warn",
      "message": "1 active locks"
    },
    "drift": {
      "status": "warn",
      "message": "? commits ahead"
    }
  },
  "summary": "degraded at 2026-04-02T12:48:17Z"
}
